========================================================================================================================
COMPARISON: Ollama (llama3:8b) vs Anthropic (Claude Haiku)
========================================================================================================================

✗ DIFFER: 0701_(DocTitle).pdf
  Ollama:     REVIEWDATET105159--san-ramon-valley-blvd-weight-certificate-for-taxable-merchandise__home-sandiego
  Anthropic:  REVIEWDATET105159--morgans-masonry-supply-masonry-supply-order__property-rental-sandiego
  Details:
    Originator: Ollama='San Ramon Valley Blvd' vs Anthropic='Morgan's Masonry Supply'
    Date:       Ollama='Unknown' vs Anthropic='Unknown'
    Summary:    Ollama='Weight certificate for taxable merchandise' vs Anthropic='Masonry supply order'
    Category:   Ollama='home-sandiego' vs Anthropic='property-rental-sandiego'

✗ DIFFER: 07230517_(DocTitle).pdf
  Ollama:     20230614T105159--chase-credit-card-statement__banking-creditcard
  Anthropic:  20230614T105159--chase-credit-card-statement__creditcard-home-sandiego
  Details:
    Originator: Ollama='Chase' vs Anthropic='Chase'
    Date:       Ollama='2023-06-14' vs Anthropic='2023-06-14'
    Summary:    Ollama='Credit card statement' vs Anthropic='Credit card statement'
    Category:   Ollama='banking-creditcard' vs Anthropic='creditcard-home-sandiego'

✗ DIFFER: 11250101_^SDGE.pdf
  Ollama:     20231222T105159--sdge-electricity-and-gas-bill__home-reviewcategory-sandiego
  Anthropic:  20240117T105159--sdge-utility-bill__rental-sandiego
  Details:
    Originator: Ollama='SDG&E' vs Anthropic='SDG&E'
    Date:       Ollama='2023-12-22' vs Anthropic='2024-01-17'
    Summary:    Ollama='Electricity and gas bill' vs Anthropic='Utility bill'
    Category:   Ollama='home-reviewcategory-sandiego' vs Anthropic='rental-sandiego'

✗ DIFFER: 19700930_BASS ئ MEDICAL GROUP ا;.pdf
  Ollama:     20230505T105159--medical-group-medical-consent-form-for-procedure__medical
  Anthropic:  20230505T105159--medical-group-informed-consent-for-surgical-procedure__medical-nikolai-sandiego
  Details:
    Originator: Ollama='MEDICAL GROUP' vs Anthropic='MEDICAL GROUP'
    Date:       Ollama='5/5/2023' vs Anthropic='2023-05-05'
    Summary:    Ollama='Medical Consent Form for Procedure' vs Anthropic='Informed consent for surgical procedure'
    Category:   Ollama='medical' vs Anthropic='medical-nikolai-sandiego'

✗ DIFFER: 19700930_INFORMED CONSENT то OPERATION AND OTHER MEDICAL SERVICE.pdf
  Ollama:     20220831T105159--sequoia-medical-consent-form__medical
  Anthropic:  20220831T105159--sequoia-surgical-pavilion-medical-procedure-consent-form__medical-property-sandiego
  Details:
    Originator: Ollama='Sequoia' vs Anthropic='Sequoia Surgical Pavilion'
    Date:       Ollama='2022-08-31' vs Anthropic='2022-08-31'
    Summary:    Ollama='Medical consent form' vs Anthropic='Medical procedure consent form'
    Category:   Ollama='medical' vs Anthropic='medical-property-sandiego'

✗ DIFFER: 19700930_ills نwedi^Goup.pdf
  Ollama:     20240123T105159--tri-valley-orthopedic-specialists-inc-medical-billing-statement__insurance-medical
  Anthropic:  20240123T105159--tri-valley-orthopedic-specialists-inc-medical-bill-for-orthopedic-services__home-sandiego
  Details:
    Originator: Ollama='Tri-Valley Orthopedic Specialists, Inc.' vs Anthropic='Tri-Valley Orthopedic Specialists, Inc.'
    Date:       Ollama='2024-01-23' vs Anthropic='2024-01-23'
    Summary:    Ollama='Medical billing statement' vs Anthropic='Medical bill for orthopedic services'
    Category:   Ollama='insurance-medical' vs Anthropic='home-sandiego'

✗ DIFFER: 19700930_٧EN٠US REFLUX DUPLEX.pdf
  Ollama:     20230331T105159--bass-medical-group-medical-report-venous-reflux-study__medical-mikhaila
  Anthropic:  20230331T105159--bass-medical-group-venous-reflux-duplex-exam-report__medical-nikolai-sandiego
  Details:
    Originator: Ollama='BASS, MEDICAL GROUP' vs Anthropic='BASS MEDICAL GROUP'
    Date:       Ollama='2023-03-31' vs Anthropic='2023-03-31'
    Summary:    Ollama='Medical report: Venous reflux study' vs Anthropic='Venous reflux duplex exam report'
    Category:   Ollama='medical-mikhaila' vs Anthropic='medical-nikolai-sandiego'

✗ DIFFER: 20160601_ا,اااا٠اااااا.pdf
  Ollama:     REVIEWDATET105159--leisure-sports-retirement-account-statement__home-sandiego
  Anthropic:  20221231T105159--leisure-sports-inc-retirement-account-statement__danville-home
  Details:
    Originator: Ollama='LEISURE SPORTS' vs Anthropic='LEISURE SPORTS, INC.'
    Date:       Ollama='10/1/22 to 12/31/22' vs Anthropic='2022-12-31'
    Summary:    Ollama='Retirement account statement' vs Anthropic='Retirement account statement'
    Category:   Ollama='home-sandiego' vs Anthropic='danville-home'

✗ DIFFER: 20180619_Vanguard.pdf
  Ollama:     20221219T105159--vanguard-529-college-savings-plan-confirmation__education-mikhaila
  Anthropic:  20221219T105159--vanguard-529-college-savings-plan-confirmation__danville-education-home
  Details:
    Originator: Ollama='Vanguard' vs Anthropic='Vanguard'
    Date:       Ollama='2022-12-19' vs Anthropic='2022-12-19'
    Summary:    Ollama='529 College Savings Plan confirmation' vs Anthropic='529 college savings plan confirmation'
    Category:   Ollama='education-mikhaila' vs Anthropic='danville-education-home'

✗ DIFFER: 20181231_ااا٠اااا٠ا٠اااااا٠٠٠٠٠اا٠ا٠٠اااا٠ااااااا٠اااااااااااااا.pdf
  Ollama:     20230101T105159--leisuresports-inc-retirement-plan-statement__Stephanie-retirement
  Anthropic:  20230101T105159--leisuresports-inc-retirement-account-statement__retirement-stephanie-taxes2023
  Details:
    Originator: Ollama='LEISURESPORTS, INC.' vs Anthropic='LEISURESPORTS, INC.'
    Date:       Ollama='2023-01-01' vs Anthropic='2023-01-01'
    Summary:    Ollama='Retirement plan statement' vs Anthropic='Retirement account statement'
    Category:   Ollama='Stephanie-retirement' vs Anthropic='retirement-stephanie-taxes2023'

✗ DIFFER: 20210528_STATEMENT OF SERV.CES RENDERED.pdf
  Ollama:     20210528T105159--brian-r-adams-dds-dental-statement__medical-stephanie
  Anthropic:  20210528T105159--brian-r-adams-dds-dental-services-statement__danville-home-medical
  Details:
    Originator: Ollama='Brian R. Adams, D.D.S.' vs Anthropic='Brian R. Adams, D.D.S.'
    Date:       Ollama='05/28/2021' vs Anthropic='2021-05-28'
    Summary:    Ollama='Dental statement' vs Anthropic='Dental services statement'
    Category:   Ollama='medical-stephanie' vs Anthropic='danville-home-medical'

✗ DIFFER: 20220224_OFFICE RECEIPT.pdf
  Ollama:     20220224T105159--dr-tsai-medical-payment-receipt__creditcard-medical
  Anthropic:  20230208T105159--clark-s-tsai-md-medical-bill-payment-receipt__medical-nikolai
  Details:
    Originator: Ollama='Dr. Tsai' vs Anthropic='CLARK S. TSAI, MD'
    Date:       Ollama='2022-02-24' vs Anthropic='2023-02-08'
    Summary:    Ollama='Medical payment receipt' vs Anthropic='Medical bill payment receipt'
    Category:   Ollama='creditcard-medical' vs Anthropic='medical-nikolai'

✗ DIFFER: 20220611_c& LMusic 2395 ВMonument Blvd Conco٢d, California 94520.pdf
  Ollama:     20220611T105159--cl-music-lease-extension-notice__danville-home
  Anthropic:  20220601T105159--c-l-music-lease-extension-notice-for-musical-instrument__danville-home
  Details:
    Originator: Ollama='c&L Music' vs Anthropic='C & L Music'
    Date:       Ollama='2022-06-11' vs Anthropic='2022-06-01'
    Summary:    Ollama='Lease extension notice' vs Anthropic='Lease extension notice for musical instrument'
    Category:   Ollama='danville-home' vs Anthropic='danville-home'

✗ DIFFER: 20220705_SíteDne.pdf
  Ollama:     20220705T105159--siteone-chemical-emergency-response-sales-invoice__home-sandiego
  Anthropic:  20220705T105159--zamora-garden-service-sales-invoice-for-landscape-supply__home-rental-sandiego
  Details:
    Originator: Ollama='SiteOne' vs Anthropic='Zamora Garden Service'
    Date:       Ollama='07/05/2022' vs Anthropic='2022-07-05'
    Summary:    Ollama='Chemical Emergency Response Sales Invoice' vs Anthropic='Sales invoice for landscape supply'
    Category:   Ollama='home-sandiego' vs Anthropic='home-rental-sandiego'

✗ DIFFER: 20220714_SiteOne_001.pdf
  Ollama:     20220714T105159--siteone-landscape-supply-order__home
  Anthropic:  20220714T105159--siteone-landscape-supply-order__household-property-rental-sandiego
  Details:
    Originator: Ollama='SiteOne' vs Anthropic='SiteOne'
    Date:       Ollama='2022-07-14' vs Anthropic='2022-07-14'
    Summary:    Ollama='Landscape Supply Order' vs Anthropic='Landscape supply order'
    Category:   Ollama='home' vs Anthropic='household-property-rental-sandiego'

✗ DIFFER: 20220714_SiteOne_002.pdf
  Ollama:     20220714T105159--siteone-order-summary-for-landscape-supply-products__home-reviewcategory
  Anthropic:  20220714T105159--siteone-landscape-supply-order__home-sandiego-shopping
  Details:
    Originator: Ollama='SiteOne' vs Anthropic='SiteOne'
    Date:       Ollama='07/14/2022' vs Anthropic='2022-07-14'
    Summary:    Ollama='Order summary for landscape supply products' vs Anthropic='Landscape supply order'
    Category:   Ollama='home-reviewcategory' vs Anthropic='home-sandiego-shopping'

✗ DIFFER: 20220831_My signature below constitutes my acknowledgement that.pdf
  Ollama:     20220831T105159--surglc-pavillon-medical-informed-consent-form__medical
  Anthropic:  20220831T105159--sequoia-surgical-pavilion-proposed-medical-procedure__medical-property-sandiego
  Details:
    Originator: Ollama='Surglc¿! Pavillon' vs Anthropic='Sequoia Surgical Pavilion'
    Date:       Ollama='2022-08-31' vs Anthropic='2022-08-31'
    Summary:    Ollama='Medical Informed Consent Form' vs Anthropic='Proposed medical procedure'
    Category:   Ollama='medical' vs Anthropic='medical-property-sandiego'

✗ DIFFER: 20220909_2ND.pdf
  Ollama:     20220909T105159--contra-costa-county-secured-property-tax-bill__danville-home
  Anthropic:  20220909T105159--contra-costa-county-treasurer-tax-collector-secured-property-tax-bill__danville-home
  Details:
    Originator: Ollama='Contra Costa County' vs Anthropic='CONTRA COSTA COUNTY TREASURER-TAX COLLECTOR'
    Date:       Ollama='2022-09-09' vs Anthropic='2022-09-09'
    Summary:    Ollama='Secured property tax bill' vs Anthropic='Secured property tax bill'
    Category:   Ollama='danville-home' vs Anthropic='danville-home'

✗ DIFFER: 20220927_STATEMENT.pdf
  Ollama:     20220927T105159--donald-schmitt-medical-bill-statement__danville-home-insurance
  Anthropic:  20220927T105159--donald-schmitt-medical-bill__danville-home
  Details:
    Originator: Ollama='DONALD SCHMITT' vs Anthropic='DONALD SCHMITT'
    Date:       Ollama='2022-09-27' vs Anthropic='2022-09-27'
    Summary:    Ollama='Medical bill statement' vs Anthropic='Medical bill'
    Category:   Ollama='danville-home-insurance' vs Anthropic='danville-home'

✗ DIFFER: 20221003_SiteOne_001.pdf
  Ollama:     20221003T105159--siteone-invoice-with-sales-and-credit-information__reviewcategory
  Anthropic:  20221003T105159--siteone-sales-invoice-for-landscape-supply__home-rental-sandiego
  Details:
    Originator: Ollama='SiteOne' vs Anthropic='SiteOne'
    Date:       Ollama='2022-10-03' vs Anthropic='2022-10-03'
    Summary:    Ollama='Invoice with sales and credit information' vs Anthropic='Sales invoice for landscape supply'
    Category:   Ollama='reviewcategory' vs Anthropic='home-rental-sandiego'

✗ DIFFER: 20221028_STATEMENT.pdf
  Ollama:     20220129T105159--donald-schmitt-medical-bill-statement__danville-home-insurance
  Anthropic:  20221129T105159--donald-schmitt-medical-bill__danville-home
  Details:
    Originator: Ollama='DONALD SCHMITT' vs Anthropic='DONALD SCHMITT'
    Date:       Ollama='2022-01-29' vs Anthropic='2022-11-29'
    Summary:    Ollama='Medical bill statement' vs Anthropic='Medical bill'
    Category:   Ollama='danville-home-insurance' vs Anthropic='danville-home'

✗ DIFFER: 20221028_٠ا,اا٠ا«ا,,,٠٠,ا,٠اااا٠٠اااا٠ا٠ا!ا٠اااااااا٠٠,ااا٠ا٠اا٠.pdf
  Ollama:     20221201T105159--golden-state-orthopedics-spine-medical-bill__danville-home-medical
  Anthropic:  20221201T105159--golden-state-orthopedics-spine-medical-bill-for-follow-up-visit__home-sandiego
  Details:
    Originator: Ollama='GOLDEN STATE ORTHOPEDICS & SPINE' vs Anthropic='GOLDEN STATE ORTHOPEDICS & SPINE'
    Date:       Ollama='12/01/2022' vs Anthropic='2022-12-01'
    Summary:    Ollama='Medical bill' vs Anthropic='Medical bill for follow-up visit'
    Category:   Ollama='danville-home-medical' vs Anthropic='home-sandiego'

✗ DIFFER: 20221110_Save time and postage.. PAY.NUNE.pdf
  Ollama:     20221110T105159--hyatt-vacation-club-annual-assessment-statement__home-rental-sandiego
  Anthropic:  20221110T105159--platinum-owners-association-inc-annual-assessment-statement__home-sandiego
  Details:
    Originator: Ollama='Hyatt Vacation Club' vs Anthropic='Platinum Owners Association, Inc.'
    Date:       Ollama='2022-11-10' vs Anthropic='2022-11-10'
    Summary:    Ollama='Annual Assessment Statement' vs Anthropic='Annual assessment statement'
    Category:   Ollama='home-rental-sandiego' vs Anthropic='home-sandiego'

✗ DIFFER: 20221128_ااا1اا'أاا'اا1.pdf
  Ollama:     20230102T105159--golden-state-orthopedics-spine-medical-bill-statement__home-insurance-medical
  Anthropic:  20230102T105159--golden-state-orthopedics-spine-medical-bill__medical
  Details:
    Originator: Ollama='GOLDEN STATE ORTHOPEDICS & SPINE' vs Anthropic='GOLDEN STATE ORTHOPEDICS & SPINE'
    Date:       Ollama='2023-01-02' vs Anthropic='2023-01-02'
    Summary:    Ollama='Medical bill statement' vs Anthropic='Medical bill'
    Category:   Ollama='home-insurance-medical' vs Anthropic='medical'

✗ DIFFER: 20221130_STATEMENT.pdf
  Ollama:     20221130T105159--round-hill-country-club-credit-card-statement__banking-home-sandiego
  Anthropic:  20221130T105159--roundm-country-ctutj-country-club-statement__danville-home
  Details:
    Originator: Ollama='Round Hill Country Club' vs Anthropic='Roundm Country ctutj'
    Date:       Ollama='2022-11-30' vs Anthropic='2022-11-30'
    Summary:    Ollama='Credit card statement' vs Anthropic='Country club statement'
    Category:   Ollama='banking-home-sandiego' vs Anthropic='danville-home'

✗ DIFFER: 20221214_12142022 CLARK S. TSAI, M.D. 2225 Port Ch!cago Hwy Conc.pdf
  Ollama:     20221214T105159--clark-s-tsai-md-medical-bill-statement__danville-home-insurance
  Anthropic:  20221214T105159--clark-s-tsai-md-medical-bill__insurance-medical
  Details:
    Originator: Ollama='CLARK S. TSAI, M.D.' vs Anthropic='CLARK S. TSAI, M.D.'
    Date:       Ollama='2022-12-14' vs Anthropic='2022-12-14'
    Summary:    Ollama='Medical bill statement' vs Anthropic='Medical bill'
    Category:   Ollama='danville-home-insurance' vs Anthropic='insurance-medical'

✗ DIFFER: 20221218_001.pdf
  Ollama:     REVIEWDATET105157--gardencentertopsoil-gardening-supply-bill__reviewcategory
  Anthropic:  REVIEWDATET105157--garden-center-topsoil-garden-center-and-topsoil-order__home-sandiego
  Details:
    Originator: Ollama='GARDENCENTER&TOPSOIL' vs Anthropic='GARDEN CENTER & TOPSOIL'
    Date:       Ollama='Unknown' vs Anthropic='Unknown'
    Summary:    Ollama='Gardening supply bill' vs Anthropic='Garden center and topsoil order'
    Category:   Ollama='reviewcategory' vs Anthropic='home-sandiego'

✗ DIFFER: 20221218_002.pdf
  Ollama:     20221129T105159--ewing-irrigation-invoice-and-payment-receipt__rental-sandiego
  Anthropic:  20221129T105159--ewing-irrigation-invoice-for-irrigation-and-landscape-materials__property-rental-sandiego
  Details:
    Originator: Ollama='Ewing Irrigation' vs Anthropic='Ewing Irrigation'
    Date:       Ollama='2022-11-29' vs Anthropic='2022-11-29'
    Summary:    Ollama='Invoice and payment receipt' vs Anthropic='Invoice for irrigation and landscape materials'
    Category:   Ollama='rental-sandiego' vs Anthropic='property-rental-sandiego'

✗ DIFFER: 20221218_003.pdf
  Ollama:     20220929T105159--ewing-irrigation-invoice-for-ewing-irrigation-products__rental-sandiego
  Anthropic:  20221129T105159--ewing-irrigation-landscape-products-invoice-for-landscaping-materials__home-sandiego
  Details:
    Originator: Ollama='Ewing Irrigation' vs Anthropic='Ewing Irrigation & Landscape Products'
    Date:       Ollama='2022-09-29' vs Anthropic='2022-11-29'
    Summary:    Ollama='Invoice for Ewing Irrigation Products' vs Anthropic='Invoice for landscaping materials'
    Category:   Ollama='rental-sandiego' vs Anthropic='home-sandiego'

✗ DIFFER: 20221218_004.pdf
  Ollama:     20230106T105159--east-bluff-no4-community-association-official-ballot-for-annual-meeting-and-election-of-directors__rental-reviewcategory
  Anthropic:  20230106T105159--east-bluff-n04-community-association-election-of-community-association-directors__hoa-home-property
  Details:
    Originator: Ollama='East Bluff No.4 Community Association' vs Anthropic='EAST BLUFF N0.4 COMMUNITY ASSOCIATION'
    Date:       Ollama='2023-01-06' vs Anthropic='2023-01-06'
    Summary:    Ollama='Official ballot for annual meeting and election of directors' vs Anthropic='Election of community association directors'
    Category:   Ollama='rental-reviewcategory' vs Anthropic='hoa-home-property'

✗ DIFFER: 20221218_2ẼÍ.pdf
  Ollama:     REVIEWDATET105159--chase-credit-card-statement__reviewcategory
  Anthropic:  REVIEWDATET105159--unknown-credit-card-statement__banking-creditcard
  Details:
    Originator: Ollama='Chase' vs Anthropic='Unknown'
    Date:       Ollama='Unknown' vs Anthropic='Unknown'
    Summary:    Ollama='Credit card statement' vs Anthropic='Credit card statement'
    Category:   Ollama='reviewcategory' vs Anthropic='banking-creditcard'

✗ DIFFER: 20221218_30.40.pdf
  Ollama:     REVIEWDATET105159--palo-alto-medical-foundation-medical-bill-payment__medical
  Anthropic:  20221031T105159--palo-alto-medical-foundation-medical-bill__medical-nikolai
  Details:
    Originator: Ollama='Palo Alto Medical Foundation' vs Anthropic='Palo Alto Medical Foundation'
    Date:       Ollama='10/31/22' vs Anthropic='2022-10-31'
    Summary:    Ollama='Medical bill payment' vs Anthropic='Medical bill'
    Category:   Ollama='medical' vs Anthropic='medical-nikolai'

✗ DIFFER: 20221218_Account Summary.pdf
  Ollama:     20221128T105159--american-express-personal-loan-statement__banking-creditcard-home
  Anthropic:  20221128T105159--american-express-credit-card-statement__creditcard-property
  Details:
    Originator: Ollama='American Express' vs Anthropic='American Express'
    Date:       Ollama='2022-11-28' vs Anthropic='2022-11-28'
    Summary:    Ollama='Personal Loan Statement' vs Anthropic='Credit card statement'
    Category:   Ollama='banking-creditcard-home' vs Anthropic='creditcard-property'

✗ DIFFER: 20221218_C.NTRA COSTA TOPSOIL, INC. 5030 !mhoff Dr ٠Ma٢t!nez,CA.pdf
  Ollama:     REVIEWDATET105159--contra-costa-topsoil-inc-weighmaster-certificate__reviewcategory
  Anthropic:  REVIEWDATET105159--contra-costa-topsoil-inc-weigh-certificate-for-topsoil-delivery__home-sandiego
  Details:
    Originator: Ollama='Contra Costa Topsoil, Inc.' vs Anthropic='Contra Costa Topsoil, Inc.'
    Date:       Ollama='Unknown' vs Anthropic='Unknown'
    Summary:    Ollama='Weighmaster certificate' vs Anthropic='Weigh certificate for topsoil delivery'
    Category:   Ollama='reviewcategory' vs Anthropic='home-sandiego'

✗ DIFFER: 20221218_CoĩĩienQ^BaẺ..pdf
  Ollama:     20221121T105159--comerica-home-equity-line-of-credit-approval-letter__danville-home
  Anthropic:  20221121T105159--comerica-bank-home-equity-line-of-credit-approval__danville-home
  Details:
    Originator: Ollama='Comerica' vs Anthropic='Comerica Bank'
    Date:       Ollama='2022-11-21' vs Anthropic='2022-11-21'
    Summary:    Ollama='Home Equity Line of Credit approval letter' vs Anthropic='Home equity line of credit approval'
    Category:   Ollama='danville-home' vs Anthropic='danville-home'

✗ DIFFER: 20221218_EAST BLUFF N0.4 COMM^ITY ASSOCIATION.pdf
  Ollama:     20221202T105159--east-bluff-n04-community-association-annual-meeting-of-members-and-election-of-directors__rental-sandiego
  Anthropic:  20221202T105159--east-bluff-no4-community-association-notice-of-annual-meeting-and-election__home-sandiego
  Details:
    Originator: Ollama='East Bluff N0.4 Community Association' vs Anthropic='EAST BLUFF NO.4 COMMUNITY ASSOCIATION'
    Date:       Ollama='2022-12-02' vs Anthropic='2022-12-02'
    Summary:    Ollama='Annual Meeting of Members and Election of Directors' vs Anthropic='Notice of annual meeting and election'
    Category:   Ollama='rental-sandiego' vs Anthropic='home-sandiego'

✗ DIFFER: 20221218_HILLER AVIATION MUSEUM.pdf
  Ollama:     20221203T105159--hiller-aviation-museum-membership-renewal-notice__home-membership
  Anthropic:  20221203T105159--hiller-aviation-museum-membership-renewal-for-aviation-museum__education-home-nikolai
  Details:
    Originator: Ollama='Hiller Aviation Museum' vs Anthropic='HILLER AVIATION MUSEUM'
    Date:       Ollama='2022-12-03' vs Anthropic='2022-12-03'
    Summary:    Ollama='Membership renewal notice' vs Anthropic='Membership renewal for aviation museum'
    Category:   Ollama='home-membership' vs Anthropic='education-home-nikolai'

✗ DIFFER: 20221218_HILLER AVIATION MUSEUM_001.pdf
  Ollama:     20211214T105159--hiller-aviation-museum-aviation-museum-annual-campaign__home-sandiego
  Anthropic:  20211214T105159--hiller-aviation-museum-fundraising-request-for-aviation-museum__education-home-sandiego
  Details:
    Originator: Ollama='Hiller Aviation Museum' vs Anthropic='Hiller Aviation Museum'
    Date:       Ollama='2021-12-14' vs Anthropic='2021-12-14'
    Summary:    Ollama='Aviation museum annual campaign' vs Anthropic='Fundraising request for aviation museum'
    Category:   Ollama='home-sandiego' vs Anthropic='education-home-sandiego'

✗ DIFFER: 20221218_Lender's reqiiìreinents..pdf
  Ollama:     20100601T105159--lender-mortgage-approval-letter__insurance
  Anthropic:  20100601T105159--unknown-mortgage-approval-letter__banking-property
  Details:
    Originator: Ollama='Lender' vs Anthropic='Unknown'
    Date:       Ollama='2010-06-01' vs Anthropic='2010-06-01'
    Summary:    Ollama='Mortgage approval letter' vs Anthropic='Mortgage approval letter'
    Category:   Ollama='insurance' vs Anthropic='banking-property'

✗ DIFFER: 20221218_MetLlfe.pdf
  Ollama:     20221201T105159--metlife-dental-benefits-explanation__insurance-medical
  Anthropic:  20221201T105159--metlife-dental-benefits-explanation__home-sandiego
  Details:
    Originator: Ollama='Metlife' vs Anthropic='MetLife'
    Date:       Ollama='December 01, 2022' vs Anthropic='2022-12-01'
    Summary:    Ollama='Dental benefits explanation' vs Anthropic='Dental benefits explanation'
    Category:   Ollama='insurance-medical' vs Anthropic='home-sandiego'

✗ DIFFER: 20221218_S1ص at.pdf
  Ollama:     REVIEWDATET105159--sloat-topsoil-weighmaster-certificate__reviewcategory
  Anthropic:  REVIEWDATET105159--garden-center-topsoil-topsoil-and-garden-supplies-delivery__home-sandiego
  Details:
    Originator: Ollama='Sloat Topsoil' vs Anthropic='GARDEN CENTER & TOPSOIL'
    Date:       Ollama='Unknown' vs Anthropic='Unknown'
    Summary:    Ollama='Weighmaster Certificate' vs Anthropic='Topsoil and garden supplies delivery'
    Category:   Ollama='reviewcategory' vs Anthropic='home-sandiego'

✗ DIFFER: 20221218_STANDARDS-BASED SKILLS ASSESSMENT.pdf
  Ollama:     REVIEWDATET105159--st-isidore-school-student-progress-report__education
  Anthropic:  REVIEWDATET105159--st-isidore-school-school-progress-report-for-grade-4-student__education-mikhaila
  Details:
    Originator: Ollama='St. Isidore School' vs Anthropic='St. Isidore School'
    Date:       Ollama='2021-2022' vs Anthropic='2021-2022'
    Summary:    Ollama='Student progress report' vs Anthropic='School progress report for grade 4 student'
    Category:   Ollama='education' vs Anthropic='education-mikhaila'

✗ DIFFER: 20221218_VỂSà.pdf
  Ollama:     20221209T105159--detailed-pest-control-llc-pest-control-invoice-and-agreement__home-sandiego
  Anthropic:  20221219T105159--detailed-pest-control-llc-pest-control-service-invoice__danville-home
  Details:
    Originator: Ollama='Detailed Pest Control, LLC' vs Anthropic='DETAILED PEST CONTROL, LLC'
    Date:       Ollama='2022-12-09' vs Anthropic='2022-12-19'
    Summary:    Ollama='Pest control invoice and agreement' vs Anthropic='Pest control service invoice'
    Category:   Ollama='home-sandiego' vs Anthropic='danville-home'

✗ DIFFER: 20221218_لمسئشج -.pdf
  Ollama:     REVIEWDATET105159--adams-credit-card-statement__reviewcategory
  Anthropic:  REVIEWDATET105159--unknown-credit-card-statement__banking-creditcard-medical-utility
  Details:
    Originator: Ollama='Adams' vs Anthropic='Unknown'
    Date:       Ollama='Unknown' vs Anthropic='Unknown'
    Summary:    Ollama='Credit card statement' vs Anthropic='Credit card statement'
    Category:   Ollama='reviewcategory' vs Anthropic='banking-creditcard-medical-utility'

✗ DIFFER: 20231204.pdf
  Ollama:     20231114T110802--renaissance-student-test-scores-report__education-mikhaila
  Anthropic:  20231114T110802--renaissance-students-math-test-results__medical-mikhaila
  Details:
    Originator: Ollama='Renaissance' vs Anthropic='Renaissance'
    Date:       Ollama='2023-11-14' vs Anthropic='2023-11-14'
    Summary:    Ollama='Student test scores report' vs Anthropic='Student's math test results'
    Category:   Ollama='education-mikhaila' vs Anthropic='medical-mikhaila'

✗ DIFFER: 20231221_ParkHotel.pdf
  Ollama:     REVIEWDATET110801--parkhotel-hotel-bill__danville-home
  Anthropic:  20231230T110801--parkhotel-altes-kaffeehaus-hotel-bill__danville-home
  Details:
    Originator: Ollama='ParkHotel' vs Anthropic='ParkHotel Altes Kaffeehaus'
    Date:       Ollama='30.12.2023' vs Anthropic='2023-12-30'
    Summary:    Ollama='Hotel bill' vs Anthropic='Hotel bill'
    Category:   Ollama='danville-home' vs Anthropic='danville-home'

✗ DIFFER: 20231227_PIUNUM.pdf
  Ollama:     20231227T110802--platinum-owners-association-payment-reminder-letter__banking-home
  Anthropic:  20231227T110802--platinum-owners-association-inc-payment-reminder-for-vacation-club__home-mortgage-sandiego
  Details:
    Originator: Ollama='Platinum Owners Association' vs Anthropic='PLATINUM OWNERS ASSOCIATION, INC.'
    Date:       Ollama='2023-12-27' vs Anthropic='2023-12-27'
    Summary:    Ollama='Payment reminder letter' vs Anthropic='Payment reminder for vacation club'
    Category:   Ollama='banking-home' vs Anthropic='home-mortgage-sandiego'

✗ DIFFER: 20231231_STATEMENT.pdf
  Ollama:     20231231T110802--round-hill-countnj-club-country-club-statement__home-reviewcategory
  Anthropic:  20231231T110802--round-hill-country-club-country-club-membership-statement__home-sandiego-utility
  Details:
    Originator: Ollama='Round Hill Countnj Club' vs Anthropic='Round Hill Country Club'
    Date:       Ollama='2023-12-31' vs Anthropic='2023-12-31'
    Summary:    Ollama='Country club statement' vs Anthropic='Country club membership statement'
    Category:   Ollama='home-reviewcategory' vs Anthropic='home-sandiego-utility'

✗ DIFFER: 20240101_SEABREEZE.pdf
  Ollama:     20240201T110801--seabreeze-management-homeowners-association-statement__home-rental-sandiego
  Anthropic:  20240201T110801--del-mar-highlands-neighborhood-homeowners-association-homeowners-association-monthly-assessment__home-rental-sandiego-utility
  Details:
    Originator: Ollama='Seabreeze Management' vs Anthropic='Del Mar Highlands Neighborhood Homeowners' Association'
    Date:       Ollama='2024-02-01' vs Anthropic='2024-02-01'
    Summary:    Ollama='Homeowners' Association statement' vs Anthropic='Homeowners association monthly assessment'
    Category:   Ollama='home-rental-sandiego' vs Anthropic='home-rental-sandiego-utility'

✗ DIFFER: 20240104_HILLER Α٧Ι٨ΤΙΟΝ MUSEUM.pdf
  Ollama:     20230110T110802--hiller-aviation-museum-membership-statement__education-home-reviewcategory
  Anthropic:  20230110T110802--hiller-aviation-museum-membership-renewal-letter__danville-home
  Details:
    Originator: Ollama='Hiller Aviation Museum' vs Anthropic='Hiller Aviation Museum'
    Date:       Ollama='2023-01-10' vs Anthropic='2023-01-10'
    Summary:    Ollama='Membership statement' vs Anthropic='Membership renewal letter'
    Category:   Ollama='education-home-reviewcategory' vs Anthropic='danville-home'

✗ DIFFER: 20240109_STATEMENT ٥F SERVICES RENDERED.pdf
  Ollama:     20240109T110801--blackhawk-dental-group-dental-statement__danville-home-medical
  Anthropic:  20240109T110801--blackhawk-dental-group-dental-services-statement__medical-rental-sandiego
  Details:
    Originator: Ollama='Blackhawk Dental Group' vs Anthropic='Blackhawk Dental Group'
    Date:       Ollama='2024-01-09' vs Anthropic='2024-01-09'
    Summary:    Ollama='Dental statement' vs Anthropic='Dental services statement'
    Category:   Ollama='danville-home-medical' vs Anthropic='medical-rental-sandiego'

✗ DIFFER: 20240115_PftKftDÍs٧s De؛.pdf
  Ollama:     REVIEWDATET110802--paradisus-dei-charitable-donation-acknowledgement__reviewcategory
  Anthropic:  20231101T110802--paradisus-dei-donation-acknowledgment-letter__danville-home
  Details:
    Originator: Ollama='Paradisus Dei' vs Anthropic='Paradisus Dei'
    Date:       Ollama='November 1,2023' vs Anthropic='2023-11-01'
    Summary:    Ollama='Charitable donation acknowledgement' vs Anthropic='Donation acknowledgment letter'
    Category:   Ollama='reviewcategory' vs Anthropic='danville-home'

✓ MATCH: 20240116.pdf
  Ollama:     REVIEWDATET110802--unknown-unknown__reviewcategory
  Anthropic:  REVIEWDATET110802--unknown-unknown__reviewcategory

✗ DIFFER: 20240116_001.pdf
  Ollama:     REVIEWDATET110802--rf-orderinvoice__reviewcategory
  Anthropic:  20150706T110802--unknown-customers-order-document__reviewcategory
  Details:
    Originator: Ollama='RF' vs Anthropic='Unknown'
    Date:       Ollama='Unknown' vs Anthropic='2015-07-06'
    Summary:    Ollama='Order/Invoice' vs Anthropic='Customer's order document'
    Category:   Ollama='reviewcategory' vs Anthropic='reviewcategory'

✗ DIFFER: 20240116_002.pdf
  Ollama:     REVIEWDATET110802--cbmerl-bank-credit-card-statement__banking-danville-home
  Anthropic:  20231218T110802--comerica-bank-credit-card-statement__danville-home-mortgage
  Details:
    Originator: Ollama='Cbmerl Bank' vs Anthropic='Comerica Bank'
    Date:       Ollama='12/18/23' vs Anthropic='2023-12-18'
    Summary:    Ollama='Credit card statement' vs Anthropic='Credit card statement'
    Category:   Ollama='banking-danville-home' vs Anthropic='danville-home-mortgage'

✗ DIFFER: 20240116_1The address or addresses to which notices from the  As.pdf
  Ollama:     REVIEWDATET110801--east-bluff-4-homeowners-association-homeowner-association-notice__home-reviewcategory
  Anthropic:  REVIEWDATET110801--east-bluff-4-homeowners-association-request-for-annual-notice-of-address-representative-and-rental-status__hoa-property-sandiego
  Details:
    Originator: Ollama='East Bluff #4 Homeowners Association' vs Anthropic='East Bluff #4 Homeowners Association'
    Date:       Ollama='Unknown' vs Anthropic='Unknown'
    Summary:    Ollama='Homeowner association notice' vs Anthropic='Request for annual notice of address, representative and rental status'
    Category:   Ollama='home-reviewcategory' vs Anthropic='hoa-property-sandiego'

✗ DIFFER: 20240116_Avalon.pdf
  Ollama:     20240101T110801--east-bluff-homeowners-association-budget-notification__associationreviewcategory-home
  Anthropic:  20240101T110801--avalon-hoa-budget-and-assessment-update__home-sandiego
  Details:
    Originator: Ollama='East Bluff' vs Anthropic='Avalon'
    Date:       Ollama='2024-01-01' vs Anthropic='2024-01-01'
    Summary:    Ollama='Homeowners Association budget notification' vs Anthropic='HOA budget and assessment update'
    Category:   Ollama='associationreviewcategory-home' vs Anthropic='home-sandiego'

✗ DIFFER: 20240116_Statement ef Account.pdf
  Ollama:     20231122T110802--comerica-credit-card-statement__banking-home
  Anthropic:  20231221T110802--comerica-credit-card-statement__banking-home-nikolai-stephanie
  Details:
    Originator: Ollama='Comerica' vs Anthropic='Comerica'
    Date:       Ollama='2023-11-22' vs Anthropic='2023-12-21'
    Summary:    Ollama='Credit card statement' vs Anthropic='Credit card statement'
    Category:   Ollama='banking-home' vs Anthropic='banking-home-nikolai-stephanie'

✗ DIFFER: 20240116_٨٧a!on.pdf
  Ollama:     20231201T110802--east-bluff-unit-no-4-community-association-homeowners-association-annual-policy-statement-and-disclosures__home-sandiego
  Anthropic:  20231201T110802--east-bluff-4-homeowners-association-annual-policy-statement-and-fee-disclosure__home-sandiego
  Details:
    Originator: Ollama='East Bluff Unit No. 4 Community Association' vs Anthropic='East Bluff 4 Homeowners Association'
    Date:       Ollama='2023-12-01' vs Anthropic='2023-12-01'
    Summary:    Ollama='Homeowners Association annual policy statement and disclosures' vs Anthropic='Annual policy statement and fee disclosure'
    Category:   Ollama='home-sandiego' vs Anthropic='home-sandiego'

✗ DIFFER: 20240124_IMPORTANT ΊΆΧ RETURN DOCUMENT ENCUOSED.pdf
  Ollama:     REVIEWDATET110802--comerica-bank-credit-card-statement__education-home-insurance-reviewcategory
  Anthropic:  REVIEWDATET110802--comerica-bank-important-tax-return-document-enclosed__danville-home
  Details:
    Originator: Ollama='Comerica Bank' vs Anthropic='COMERICA BANK'
    Date:       Ollama='Unknown' vs Anthropic='Unknown'
    Summary:    Ollama='Credit card statement' vs Anthropic='Important tax return document enclosed'
    Category:   Ollama='education-home-insurance-reviewcategory' vs Anthropic='danville-home'

✗ DIFFER: 20240208_اه JOHN MUIR.pdf
  Ollama:     20231225T110800--john-muir-health-medical-mammogram-appointment-reminder__medical
  Anthropic:  20231225T110800--john-muir-health-routine-annual-mammogram-reminder__medical-stephanie
  Details:
    Originator: Ollama='John Muir Health' vs Anthropic='John Muir Health'
    Date:       Ollama='2023-12-25' vs Anthropic='2023-12-25'
    Summary:    Ollama='Medical mammogram appointment reminder' vs Anthropic='Routine annual mammogram reminder'
    Category:   Ollama='medical' vs Anthropic='medical-stephanie'

✗ DIFFER: 26221129_STATEMENT.pdf
  Ollama:     20221129T110805--donald-schmitt-medical-statement__danville-home-insurance
  Anthropic:  20221129T110805--donald-schmitt-medical-bill__danville-home-medical
  Details:
    Originator: Ollama='Donald Schmitt' vs Anthropic='DONALD SCHMITT'
    Date:       Ollama='11/29/2022' vs Anthropic='2022-11-29'
    Summary:    Ollama='Medical statement' vs Anthropic='Medical bill'
    Category:   Ollama='danville-home-insurance' vs Anthropic='danville-home-medical'

✗ DIFFER: 26230328_إو JOHN MUIR.pdf
  Ollama:     20230417T110802--john-muir-health-medical-bill__home-insurance-medical
  Anthropic:  20230417T110802--john-muir-health-medical-bill__medical-sandiego
  Details:
    Originator: Ollama='John Muir Health' vs Anthropic='JOHN MUIR HEALTH'
    Date:       Ollama='04/17/2023' vs Anthropic='2023-04-17'
    Summary:    Ollama='Medical bill' vs Anthropic='Medical bill'
    Category:   Ollama='home-insurance-medical' vs Anthropic='medical-sandiego'

✗ DIFFER: 28231101_Save time and postage! PAY ONLINE.pdf
  Ollama:     20231101T110800--nikolai-stephanie-k-schlegel-platinum-oa-annual-assessment-statement__home-reviewcategory
  Anthropic:  20231101T110800--platinum-owners-association-inc-annual-assessment-statement__home-sandiego
  Details:
    Originator: Ollama='Nikolai & Stephanie K. Schlegel PLATINUM OA' vs Anthropic='PLATINUM OWNERS ASSOCIATION, INC.'
    Date:       Ollama='2023-11-01' vs Anthropic='2023-11-01'
    Summary:    Ollama='Annual Assessment Statement' vs Anthropic='Annual assessment statement'
    Category:   Ollama='home-reviewcategory' vs Anthropic='home-sandiego'

✗ DIFFER: 59490122_ا% Health.pdf
  Ollama:     20230604T110800--ucsf-benioff-childrens-hospital-oakland-medical-bill-statement__insurance-medical
  Anthropic:  20230505T110800--ucsf-benioff-childrens-medical-bill__medical-nikolai-sandiego
  Details:
    Originator: Ollama='UCSF Benioff Children's Hospital Oakland' vs Anthropic='UCSF Benioff Children's'
    Date:       Ollama='2023-06-04' vs Anthropic='2023-05-05'
    Summary:    Ollama='Medical bill statement' vs Anthropic='Medical bill'
    Category:   Ollama='insurance-medical' vs Anthropic='medical-nikolai-sandiego'

✗ DIFFER: 73300114_ا٠1ااا٠اا1.pdf
  Ollama:     20231024T110802--donald-schmitt-credit-card-statement__home-insurance
  Anthropic:  20231024T110802--donald-schmitt-medical-bill__danville-home
  Details:
    Originator: Ollama='DONALD SCHMITT' vs Anthropic='DONALD SCHMITT'
    Date:       Ollama='10/24/2023' vs Anthropic='2023-10-24'
    Summary:    Ollama='Credit card statement' vs Anthropic='Medical bill'
    Category:   Ollama='home-insurance' vs Anthropic='danville-home'

✗ DIFFER: Blackhawk_Dental_June_21_2023.pdf
  Ollama:     REVIEWDATET110801--blackhawk-dental-care-dental-statement-and-care-instructions__danville-home-medical
  Anthropic:  20230621T110801--blackhawk-dental-group-dental-services-statement__home-sandiego
  Details:
    Originator: Ollama='Blackhawk Dental Care' vs Anthropic='Blackhawk Dental Group'
    Date:       Ollama='Unknown (but between 2015-2025 based on document dates)' vs Anthropic='2023-06-21'
    Summary:    Ollama='Dental statement and care instructions' vs Anthropic='Dental services statement'
    Category:   Ollama='danville-home-medical' vs Anthropic='home-sandiego'

✗ DIFFER: Blackhawk_Dental_June_28_2023.pdf
  Ollama:     20230628T110802--blackhawk-denta-group-dental-treatment-plan-and-billing-statement__danville-home-insurance-medical
  Anthropic:  20230628T110802--blackhawk-dental-group-dental-treatment-plan-and-bill__danville-dental-home-medical
  Details:
    Originator: Ollama='Blackhawk Denta! Group' vs Anthropic='Blackhawk Dental Group'
    Date:       Ollama='06/28/2023' vs Anthropic='2023-06-28'
    Summary:    Ollama='Dental treatment plan and billing statement' vs Anthropic='Dental treatment plan and bill'
    Category:   Ollama='danville-home-insurance-medical' vs Anthropic='danville-dental-home-medical'

✗ DIFFER: Chase_Freedmo_Unlimited_July_14_2023.pdf
  Ollama:     20230714T110801--chase-credit-card-statement__banking-creditcard
  Anthropic:  20230714T110801--chase-credit-card-statement__creditcard-home-sandiego
  Details:
    Originator: Ollama='Chase' vs Anthropic='Chase'
    Date:       Ollama='2023-07-14' vs Anthropic='2023-07-14'
    Summary:    Ollama='Credit card statement' vs Anthropic='Credit card statement'
    Category:   Ollama='banking-creditcard' vs Anthropic='creditcard-home-sandiego'

✗ DIFFER: Chase_Freedom_Unlimited_August_14_2023.pdf
  Ollama:     20230814T110801--chase-credit-card-statement-with-rewards-and-payment-due-dates__banking-home-sandiego
  Anthropic:  20230717T110801--chase-credit-card-statement__creditcard-home-sandiego
  Details:
    Originator: Ollama='Chase' vs Anthropic='Chase'
    Date:       Ollama='2023-08-14' vs Anthropic='2023-07-17'
    Summary:    Ollama='Credit card statement with rewards and payment due dates' vs Anthropic='Credit card statement'
    Category:   Ollama='banking-home-sandiego' vs Anthropic='creditcard-home-sandiego'

✗ DIFFER: Chef_Cooking_Receipts.pdf
  Ollama:     REVIEWDATET110802--unknown-unknown__reviewcategory
  Anthropic:  REVIEWDATET110802--unknown-unknown-document__home-rental-sandiego
  Details:
    Originator: Ollama='Unknown' vs Anthropic='Unknown'
    Date:       Ollama='Unknown' vs Anthropic='Unknown'
    Summary:    Ollama='Unknown' vs Anthropic='Unknown document'
    Category:   Ollama='reviewcategory' vs Anthropic='home-rental-sandiego'

✗ DIFFER: Comerica-HELOC-Loan-Application_and_other_documents.pdf
  Ollama:     20221118T110801--comerica-bank-loan-authorization-and-tax-consent-form__danville-home
  Anthropic:  20221118T110801--comerica-bank-loan-authorization-and-taxpayer-consent__home-sandiego
  Details:
    Originator: Ollama='Comerica Bank' vs Anthropic='Comerica Bank'
    Date:       Ollama='2022-11-18' vs Anthropic='2022-11-18'
    Summary:    Ollama='Loan authorization and tax consent form' vs Anthropic='Loan authorization and taxpayer consent'
    Category:   Ollama='danville-home' vs Anthropic='home-sandiego'

✗ DIFFER: Comerica_Bank_June_2023.pdf
  Ollama:     20230618T110802--comerica-bank-credit-card-statement__banking-home
  Anthropic:  20230618T110802--comerica-bank-account-line-of-credit-statement__banking-home-sandiego
  Details:
    Originator: Ollama='Comerica Bank' vs Anthropic='Comerica Bank'
    Date:       Ollama='2023-06-18' vs Anthropic='2023-06-18'
    Summary:    Ollama='Credit card statement' vs Anthropic='Account Line of Credit statement'
    Category:   Ollama='banking-home' vs Anthropic='banking-home-sandiego'

✗ DIFFER: Comerica_Bank_May_2023.pdf
  Ollama:     20230520T110802--comerica-credit-card-statement__banking-danville-home
  Anthropic:  20230520T110802--comerica-bank-bank-account-statement__banking-danville-home
  Details:
    Originator: Ollama='Comerica' vs Anthropic='Comerica Bank'
    Date:       Ollama='2023-05-20' vs Anthropic='2023-05-20'
    Summary:    Ollama='Credit card statement' vs Anthropic='Bank account statement'
    Category:   Ollama='banking-danville-home' vs Anthropic='banking-danville-home'

✗ DIFFER: Comerica_July_24_2023.pdf
  Ollama:     20230623T110802--comerica-credit-card-statement__banking-home
  Anthropic:  20230623T110802--comerica-credit-card-statement__banking-home-sandiego
  Details:
    Originator: Ollama='Comerica' vs Anthropic='Comerica'
    Date:       Ollama='2023-06-23' vs Anthropic='2023-06-23'
    Summary:    Ollama='Credit card statement' vs Anthropic='Credit card statement'
    Category:   Ollama='banking-home' vs Anthropic='banking-home-sandiego'

✗ DIFFER: Critter_Creek_Veterinary_Hospital_June_26_2023.pdf
  Ollama:     REVIEWDATET110802--critter-creek-veterinary-invoice-for-pet-care-services__lucy-medical
  Anthropic:  20230626T110802--critter-creek-veterinary-hospital-veterinary-invoice-for-pet-care-services__home-medical-sandiego
  Details:
    Originator: Ollama='Critter Creek' vs Anthropic='Critter Creek Veterinary Hospital'
    Date:       Ollama='Unknown' vs Anthropic='2023-06-26'
    Summary:    Ollama='Veterinary invoice for pet care services' vs Anthropic='Veterinary invoice for pet care services'
    Category:   Ollama='lucy-medical' vs Anthropic='home-medical-sandiego'

✗ DIFFER: DMV_Renewal_Prius_September_2023.pdf
  Ollama:     20230902T110801--department-of-motor-vehicles-vehicle-registration-renewal-notice__home-sandiego
  Anthropic:  20230902T110801--department-of-motor-vehicles-vehicle-registration-renewal-notice__home-sandiego-taxes-vehicle
  Details:
    Originator: Ollama='Department of Motor Vehicles' vs Anthropic='Department of Motor Vehicles'
    Date:       Ollama='09/02/2023' vs Anthropic='2023-09-02'
    Summary:    Ollama='Vehicle Registration Renewal Notice' vs Anthropic='Vehicle registration renewal notice'
    Category:   Ollama='home-sandiego' vs Anthropic='home-sandiego-taxes-vehicle'

✗ DIFFER: Del_Mar_Highlands_HOA_Election.pdf
  Ollama:     20230725T110802--delmar-highlands-neighborhood-hoa-hoa-annual-meeting-and-election__home-sandiego
  Anthropic:  20230725T110802--hoa-elections-of-california-inc-annual-homeowners-association-meeting__home-rental-sandiego
  Details:
    Originator: Ollama='DelMar Highlands Neighborhood HOA' vs Anthropic='HOA Elections of California, Inc.'
    Date:       Ollama='2023-07-25' vs Anthropic='2023-07-25'
    Summary:    Ollama='HOA Annual Meeting and Election' vs Anthropic='Annual homeowners' association meeting'
    Category:   Ollama='home-sandiego' vs Anthropic='home-rental-sandiego'

✗ DIFFER: Detailed_Pest_Control_June_15_2023.pdf
  Ollama:     REVIEWDATET110802--detailed-pest-control-llc-pest-control-service-bill__danville-home
  Anthropic:  20230622T110802--detailed-pest-control-llc-pest-control-service-invoice__home-sandiego
  Details:
    Originator: Ollama='Detailed Pest Control, LLC' vs Anthropic='DETAILED PEST CONTROL, LLC'
    Date:       Ollama='06/23/' vs Anthropic='2023-06-22'
    Summary:    Ollama='Pest control service bill' vs Anthropic='Pest control service invoice'
    Category:   Ollama='danville-home' vs Anthropic='home-sandiego'

✗ DIFFER: East_Bluff_No4_HOA_Election_July_2023.pdf
  Ollama:     20230721T110802--the-inspectors-of-election-community-association-election-announcement__reviewcategory
  Anthropic:  20230721T110802--the-inspectors-of-election-llc-tie-call-for-candidates-for-community-association-election__home-sandiego
  Details:
    Originator: Ollama='The Inspectors of Election' vs Anthropic='The Inspectors of Election, LLC (TIE)'
    Date:       Ollama='2023-07-21' vs Anthropic='2023-07-21'
    Summary:    Ollama='Community Association election announcement' vs Anthropic='Call for candidates for community association election'
    Category:   Ollama='reviewcategory' vs Anthropic='home-sandiego'

✗ DIFFER: East_Bluff_No4_HOA_Election_Part2 _July_2023.pdf
  Ollama:     20231023T110800--eastbluffno-4-community-association-candidate-nomination-form-for-community-association-election__reviewcategory
  Anthropic:  20231023T110800--east-bluff-no-4-community-association-candidate-nomination-form-for-election-of-directors__home-sandiego
  Details:
    Originator: Ollama='EastBluffNo. 4 Community Association' vs Anthropic='East Bluff No. 4 Community Association'
    Date:       Ollama='2023-10-23' vs Anthropic='2023-10-23'
    Summary:    Ollama='Candidate nomination form for community association election' vs Anthropic='Candidate nomination form for election of directors'
    Category:   Ollama='reviewcategory' vs Anthropic='home-sandiego'

✗ DIFFER: GoldenStateOrthopedics-02-01-2023.pdf
  Ollama:     20230201T110802--golden-state-orthopedics-spine-medical-bill-with-payment-and-adjustment-details__insurance-medical
  Anthropic:  20230201T110802--golden-state-orthopedics-spine-medical-bill-for-orthopedic-services__medical-property
  Details:
    Originator: Ollama='GOLDEN STATE ORTHOPEDICS & SPINE' vs Anthropic='GOLDEN STATE ORTHOPEDICS & SPINE'
    Date:       Ollama='02/01/2023' vs Anthropic='2023-02-01'
    Summary:    Ollama='Medical bill with payment and adjustment details' vs Anthropic='Medical bill for orthopedic services'
    Category:   Ollama='insurance-medical' vs Anthropic='medical-property'

✗ DIFFER: Hacienda_Surgery_Center_Post_Op.pdf
  Ollama:     REVIEWDATET110802--hacienda-surgery-center-medical-discharge-instructions__medical
  Anthropic:  REVIEWDATET110802--hacienda-surgery-center-discharge-instructions-for-interventional-spinepain-procedures__medical-sandiego
  Details:
    Originator: Ollama='Hacienda Surgery Center' vs Anthropic='Hacienda Surgery Center'
    Date:       Ollama='Unknown' vs Anthropic='Unknown'
    Summary:    Ollama='Medical discharge instructions' vs Anthropic='Discharge instructions for interventional spine/pain procedures'
    Category:   Ollama='medical' vs Anthropic='medical-sandiego'

✗ DIFFER: Hacienda_Surgery_Center_Post_Op_Part2.pdf
  Ollama:     20230720T110802--hacienda-surgery-center-covid-19-patient-education-and-discharge-instructions__medical-reviewcategory
  Anthropic:  20230720T110802--surgery-center-medical-discharge-instructions__medical
  Details:
    Originator: Ollama='Hacienda Surgery Center' vs Anthropic='SURGERY CENTER'
    Date:       Ollama='2023-07-20' vs Anthropic='2023-07-20'
    Summary:    Ollama='COVID-19 patient education and discharge instructions' vs Anthropic='Medical discharge instructions'
    Category:   Ollama='medical-reviewcategory' vs Anthropic='medical'

✗ DIFFER: High_Speed_Rail_Alliance_June_06_2023.pdf
  Ollama:     REVIEWDATET110802--high-speed-rail-alliance-high-speed-rail-advocacy-and-infrastructure-development__danville-home
  Anthropic:  20230614T110802--high-speed-rail-alliance-request-for-additional-contribution-to-support-passenger-rail__danville-home
  Details:
    Originator: Ollama='High Speed Rail Alliance' vs Anthropic='High Speed Rail Alliance'
    Date:       Ollama='June 2023' vs Anthropic='2023-06-14'
    Summary:    Ollama='High-speed rail advocacy and infrastructure development' vs Anthropic='Request for additional contribution to support passenger rail'
    Category:   Ollama='danville-home' vs Anthropic='danville-home'

✗ DIFFER: IRS_Notice_July_05_2023.pdf
  Ollama:     20230705T110802--internal-revenue-service-irs-tax-relief-notification__Sandiego-danville-home
  Anthropic:  20230705T110802--internal-revenue-service-tax-notice-with-disaster-relief-information__home-sandiego
  Details:
    Originator: Ollama='Internal Revenue Service' vs Anthropic='Internal Revenue Service'
    Date:       Ollama='2023-07-05' vs Anthropic='2023-07-05'
    Summary:    Ollama='IRS Tax Relief Notification' vs Anthropic='Tax notice with disaster relief information'
    Category:   Ollama='Sandiego-danville-home' vs Anthropic='home-sandiego'

✗ DIFFER: Jamie_July_01_2023.pdf
  Ollama:     REVIEWDATET110802--lelop-credit-card-statement__reviewcategory
  Anthropic:  20220111T110802--vanguard-credit-card-statement__reviewcategory
  Details:
    Originator: Ollama='LElop' vs Anthropic='Vanguard'
    Date:       Ollama='Unknown' vs Anthropic='2022-01-11'
    Summary:    Ollama='Credit card statement' vs Anthropic='Credit card statement'
    Category:   Ollama='reviewcategory' vs Anthropic='reviewcategory'

✗ DIFFER: Jamie_July_27_2023.pdf
  Ollama:     REVIEWDATET110802--pge-utility-bill__reviewcategory
  Anthropic:  20220501T110802--chase-credit-card-statement__banking
  Details:
    Originator: Ollama='PG&E' vs Anthropic='Chase'
    Date:       Ollama='Unknown' vs Anthropic='2022-05-01'
    Summary:    Ollama='Utility bill' vs Anthropic='Credit card statement'
    Category:   Ollama='reviewcategory' vs Anthropic='banking'

✗ DIFFER: John_Hancock_June_09_2023.pdf
  Ollama:     20230609T110801--john-hancock-life-insurance-company-long-term-care-insurance-premium-notice__home-insurance-sandiego
  Anthropic:  20230609T110801--john-hancock-life-insurance-company-usa-premium-notice-for-group-long-term-care-insurance__home-insurance-sandiego
  Details:
    Originator: Ollama='John Hancock Life Insurance Company' vs Anthropic='John Hancock Life Insurance Company (U.S.A.)'
    Date:       Ollama='2023-06-09' vs Anthropic='2023-06-09'
    Summary:    Ollama='Long-term care insurance premium notice' vs Anthropic='Premium notice for group long-term care insurance'
    Category:   Ollama='home-insurance-sandiego' vs Anthropic='home-insurance-sandiego'

✗ DIFFER: Lucy_Health_Record_Fetch-ID.pdf
  Ollama:     REVIEWDATET110802--bernedoodles-and-co-puppy-contract__medical-sandiego-veterinary, home
  Anthropic:  20230507T110802--bernedoodles-and-co-puppy-health-record-and-contract__home-rental-sandiego
  Details:
    Originator: Ollama='Bernedoodles and Co' vs Anthropic='Bernedoodles and Co'
    Date:       Ollama='5/7/23' vs Anthropic='2023-05-07'
    Summary:    Ollama='Puppy contract' vs Anthropic='Puppy health record and contract'
    Category:   Ollama='medical-sandiego-veterinary, home' vs Anthropic='home-rental-sandiego'

✗ DIFFER: MetLife_July_05_2023.pdf
  Ollama:     20230705T110802--metlife-dental-benefits-explanation__insurance-medical-utility
  Anthropic:  20230705T110802--metlife-dental-benefits-explanation__medical-sandiego
  Details:
    Originator: Ollama='MetLife' vs Anthropic='MetLife'
    Date:       Ollama='2023-07-05' vs Anthropic='2023-07-05'
    Summary:    Ollama='Dental benefits explanation' vs Anthropic='Dental benefits explanation'
    Category:   Ollama='insurance-medical-utility' vs Anthropic='medical-sandiego'

✗ DIFFER: MetLife_July_21_2023.pdf
  Ollama:     20230721T110802--metlife-dental-benefits-explanation__home-insurance-medical-sandiego
  Anthropic:  20230721T110802--metlife-dental-benefits-explanation__home-insurance-sandiego
  Details:
    Originator: Ollama='MetLife' vs Anthropic='MetLife'
    Date:       Ollama='2023-07-21' vs Anthropic='2023-07-21'
    Summary:    Ollama='Dental benefits explanation' vs Anthropic='Dental benefits explanation'
    Category:   Ollama='home-insurance-medical-sandiego' vs Anthropic='home-insurance-sandiego'

✗ DIFFER: MetLife_June_26_2023.pdf
  Ollama:     20230627T110802--metlife-dental-benefits-claim-summary__home-insurance
  Anthropic:  20230627T110802--metlife-dental-benefits-explanation__insurance-medical-stephanie
  Details:
    Originator: Ollama='MetLife' vs Anthropic='MetLife'
    Date:       Ollama='2023-06-27' vs Anthropic='2023-06-27'
    Summary:    Ollama='Dental benefits claim summary' vs Anthropic='Dental benefits explanation'
    Category:   Ollama='home-insurance' vs Anthropic='insurance-medical-stephanie'

✗ DIFFER: Metlife_July_13_2023.pdf
  Ollama:     20230713T110802--metlife-dental-benefits-explanation-and-claim-summary__danville-home-insurance
  Anthropic:  20230713T110802--metlife-dental-benefits-explanation__insurance-medical-utility
  Details:
    Originator: Ollama='MetLife' vs Anthropic='MetLife'
    Date:       Ollama='2023-07-13' vs Anthropic='2023-07-13'
    Summary:    Ollama='Dental benefits explanation and claim summary' vs Anthropic='Dental benefits explanation'
    Category:   Ollama='danville-home-insurance' vs Anthropic='insurance-medical-utility'

✗ DIFFER: Mikhaila_Grade5_YearEnd_ReportCard.pdf
  Ollama:     20230605T110802--st-isidore-school-grade-5-trimester-report-card__education-mikhaila
  Anthropic:  20230605T110802--st-isidore-school-5th-grade-trimester-report-card__education-mikhaila
  Details:
    Originator: Ollama='St. Isidore School' vs Anthropic='St. Isidore School'
    Date:       Ollama='2023-06-05' vs Anthropic='2023-06-05'
    Summary:    Ollama='Grade 5 Trimester Report Card' vs Anthropic='5th grade trimester report card'
    Category:   Ollama='education-mikhaila' vs Anthropic='education-mikhaila'

✗ DIFFER: Mikhaila_Renaissance_Parent_Report_Q3_2023.pdf
  Ollama:     20230510T110802--renaissance-education-reports-star-reading-and-star-math__education-mikhaila
  Anthropic:  20230512T110802--renaissance-student-reading-and-math-test-scores__education-mikhaila
  Details:
    Originator: Ollama='RENAISSANCE' vs Anthropic='RENAISSANCE'
    Date:       Ollama='2023-05-10' vs Anthropic='2023-05-12'
    Summary:    Ollama='Education reports (Star Reading and Star Math)' vs Anthropic='Student reading and math test scores'
    Category:   Ollama='education-mikhaila' vs Anthropic='education-mikhaila'

✗ DIFFER: Mikhaila_UltraSound_other_Test_Results.pdf
  Ollama:     20221024T110802--john-muir-health-medical-ultrasound-test-results__medical-mikhaila
  Anthropic:  20221024T110802--john-muir-health-medical-test-results-for-abdominal-ultrasound__medical-mikhaila
  Details:
    Originator: Ollama='John Muir Health' vs Anthropic='John Muir Health'
    Date:       Ollama='2022-10-24' vs Anthropic='2022-10-24'
    Summary:    Ollama='Medical ultrasound test results' vs Anthropic='Medical test results for abdominal ultrasound'
    Category:   Ollama='medical-mikhaila' vs Anthropic='medical-mikhaila'

✗ DIFFER: Platinum_Ownership.pdf
  Ollama:     REVIEWDATET110802--plitinum-owners-association-inc-payment-reminder-letter__banking-danville-home
  Anthropic:  20230626T110802--platinum-owners-association-inc-payment-reminder-notice__home-sandiego-utility
  Details:
    Originator: Ollama='PliTINUM OWNERS ASSOCIATION, INC.' vs Anthropic='PLATINUM OWNERS ASSOCIATION, INC.'
    Date:       Ollama='07/05/23' vs Anthropic='2023-06-26'
    Summary:    Ollama='Payment reminder letter' vs Anthropic='Payment reminder notice'
    Category:   Ollama='banking-danville-home' vs Anthropic='home-sandiego-utility'

✗ DIFFER: Platinum_Ownership_July_2023.pdf
  Ollama:     20230705T110802--platinum-owners-association-inc-payment-confirmation-statement__danville-home
  Anthropic:  20230705T110802--platinum-owners-association-inc-confirmation-of-payment-to-homeowners-association__home-sandiego
  Details:
    Originator: Ollama='PLATINUM OWNERS ASSOCIATION, INC.' vs Anthropic='PLATINUM OWNERS ASSOCIATION, INC.'
    Date:       Ollama='2023-07-05' vs Anthropic='2023-07-05'
    Summary:    Ollama='Payment confirmation statement' vs Anthropic='Confirmation of payment to homeowners association'
    Category:   Ollama='danville-home' vs Anthropic='home-sandiego'

✗ DIFFER: RHCC_June_2023.pdf
  Ollama:     20230630T110802--round-hill-country-club-country-club-statement__home-rental-sandiego
  Anthropic:  20230630T110802--round-hill-country-club-country-club-account-statement__home-sandiego
  Details:
    Originator: Ollama='Round Hill Country Club' vs Anthropic='Round Hill Country Club'
    Date:       Ollama='2023-06-30' vs Anthropic='2023-06-30'
    Summary:    Ollama='Country club statement' vs Anthropic='Country club account statement'
    Category:   Ollama='home-rental-sandiego' vs Anthropic='home-sandiego'

✓ MATCH: RHCC_Statement_July_2023.pdf
  Ollama:     20230731T110802--round-hill-country-club-country-club-statement__danville-home
  Anthropic:  20230731T110802--round-hill-country-club-country-club-statement__danville-home

✗ DIFFER: SanRamon-Fire-District-Stephanie.pdf
  Ollama:     20230130T110802--san-ramon-valley-fire-protection-district-medical-bill__home-medical
  Anthropic:  20230130T110802--san-ramon-valley-fire-protection-district-emergency-medical-bill__danville,utility-home
  Details:
    Originator: Ollama='SAN RAMON VALLEY FIRE PROTECTION DISTRICT' vs Anthropic='SAN RAMON VALLEY FIRE PROTECTION DISTRICT'
    Date:       Ollama='2023-01-30' vs Anthropic='2023-01-30'
    Summary:    Ollama='Medical bill' vs Anthropic='Emergency medical bill'
    Category:   Ollama='home-medical' vs Anthropic='danville,utility-home'

✗ DIFFER: SeaBreeze_August_01_2023.pdf
  Ollama:     20230701T110802--seabreeze-management-homeowners-association-statement__home-sandiego
  Anthropic:  20230801T110802--seabreeze-management-company-homeowners-association-monthly-assessment__home-rental-sandiego-seahorn
  Details:
    Originator: Ollama='Seabreeze Management' vs Anthropic='SEABREEZE MANAGEMENT COMPANY'
    Date:       Ollama='2023-07-01' vs Anthropic='2023-08-01'
    Summary:    Ollama='Homeowners' Association statement' vs Anthropic='Homeowners association monthly assessment'
    Category:   Ollama='home-sandiego' vs Anthropic='home-rental-sandiego-seahorn'

✗ DIFFER: SeaBreeze_June_17_2023.pdf
  Ollama:     REVIEWDATET110802--de-mar-highlands-neighborhood-homeowners-association-hoa-statement-and-payment-instructions__rental-sandiego
  Anthropic:  20230617T110802--seabreeze-homeowners-association-statement__rental-sandiego
  Details:
    Originator: Ollama='De Mar Highlands Neighborhood Homeowners' Association' vs Anthropic='SEABREEZE'
    Date:       Ollama='Unknown' vs Anthropic='2023-06-17'
    Summary:    Ollama='HOA statement and payment instructions' vs Anthropic='Homeowners association statement'
    Category:   Ollama='rental-sandiego' vs Anthropic='rental-sandiego'

✗ DIFFER: United Healthcare_Coverage_June_02_2023.pdf
  Ollama:     20230602T110802--united-healthcare-prior-authorization-approval-for-medical-services__home-insurance-medical
  Anthropic:  20230602T110802--unitedhealthcare-authorization-for-medical-procedure__medical-sandiego
  Details:
    Originator: Ollama='United Healthcare' vs Anthropic='UnitedHealthcare'
    Date:       Ollama='June 2, 2023' vs Anthropic='2023-06-02'
    Summary:    Ollama='Prior Authorization Approval for medical services' vs Anthropic='Authorization for medical procedure'
    Category:   Ollama='home-insurance-medical' vs Anthropic='medical-sandiego'

========================================================================================================================
SUMMARY STATISTICS
========================================================================================================================
Total files:        105
Exact matches:      2 (1.9%)
Differences:        103 (98.1%)
Missing entries:    0

